,Unnamed: 0,abstract,web_url,source,headline,keywords,pub_date,section_name,byline,type_of_material,word_count,Column1,stock_price,Unnamed: 12,Unnamed: 13,Unnamed: 14,Unnamed: 15,Unnamed: 16
244,244.0,The organizers say they will have enough signatures by Monday to file for an election with the National Labor Relations Board. The company is pushing back.,https://www.nytimes.com/2021/10/21/technology/amazon-workers-union-staten-island.html,The New York Times,"{'main': 'Amazon Workers on Staten Island Aim for Union Vote', 'kicker': None, 'content_kicker': None, 'print_headline': 'Amazon Faces a Union Vote in New York', 'name': None, 'seo': None, 'sub': None}","[{'name': 'organizations', 'value': 'Amazon.com Inc', 'rank': 1, 'major': 'N'}, {'name': 'subject', 'value': 'Organized Labor', 'rank': 2, 'major': 'N'}, {'name': 'glocations', 'value': 'Staten Island (NYC)', 'rank': 3, 'major': 'N'}, {'name': 'subject', 'value': 'Labor and Jobs', 'rank': 4, 'major': 'N'}, {'name': 'subject', 'value': 'Strikes', 'rank': 5, 'major': 'N'}, {'name': 'subject', 'value': 'Workplace Hazards and Violations', 'rank': 6, 'major': 'N'}, {'name': 'subject', 'value': 'Wages and Salaries', 'rank': 7, 'major': 'N'}, {'name': 'subject', 'value': 'Collective Bargaining', 'rank': 8, 'major': 'N'}, {'name': 'organizations', 'value': 'National Labor Relations Board', 'rank': 9, 'major': 'N'}, {'name': 'glocations', 'value': 'Bessemer (Ala)', 'rank': 10, 'major': 'N'}, {'name': 'persons', 'value': 'Smalls, Christian', 'rank': 11, 'major': 'N'}, {'name': 'persons', 'value': 'Palmer, Derrick', 'rank': 12, 'major': 'N'}]",2021-10-21T09:00:24+0000,Technology,"{'original': 'By Karen Weise and Coral Murphy Marcos', 'person': [{'firstname': 'Karen', 'middlename': None, 'lastname': 'Weise', 'qualifier': None, 'title': None, 'role': 'reported', 'organization': '', 'rank': 1}, {'firstname': 'Coral', 'middlename': 'Murphy', 'lastname': 'Marcos', 'qualifier': None, 'title': None, 'role': 'reported', 'organization': '', 'rank': 2}], 'organization': None}",News,1440,,,,,,,
245,245.0,We’re interested in learning as much as possible about how employers manage their work forces.,https://www.nytimes.com/2021/10/21/business/amazon-powerful-companies-callout.html,The New York Times,"{'main': 'Do You Work at Amazon or Another Powerful Employer?', 'kicker': None, 'content_kicker': None, 'print_headline': None, 'name': None, 'seo': None, 'sub': None}","[{'name': 'subject', 'value': 'internal-open-access', 'rank': 1, 'major': 'N'}, {'name': 'subject', 'value': 'Labor and Jobs', 'rank': 2, 'major': 'N'}, {'name': 'organizations', 'value': 'Amazon.com Inc', 'rank': 3, 'major': 'N'}]",2021-10-21T11:57:59+0000,Business Day,"{'original': 'By The New York Times', 'person': [], 'organization': 'The New York Times'}",News,127,,,,,,,
246,246.0,The agreement comes as more than 130 countries agreed this month to an overhaul of the international tax system that will see nations adopt a global minimum tax of 15 percent.,https://www.nytimes.com/2021/10/21/business/global-tax-agreement-digital-services.html,The New York Times,"{'main': 'U.S. agrees to drop tariffs on countries that imposed digital services taxes as a global tax overhaul moves ahead.', 'kicker': None, 'content_kicker': None, 'print_headline': 'U.S. Agrees to Drop Tariffs in Deal to End Digital Tax', 'name': None, 'seo': None, 'sub': None}","[{'name': 'subject', 'value': 'Federal Taxes (US)', 'rank': 1, 'major': 'N'}, {'name': 'subject', 'value': 'Corporate Taxes', 'rank': 2, 'major': 'N'}, {'name': 'subject', 'value': 'United States Politics and Government', 'rank': 3, 'major': 'N'}, {'name': 'subject', 'value': 'International Trade and World Market', 'rank': 4, 'major': 'N'}, {'name': 'organizations', 'value': 'Amazon.com Inc', 'rank': 5, 'major': 'N'}, {'name': 'organizations', 'value': 'Facebook Inc', 'rank': 6, 'major': 'N'}, {'name': 'organizations', 'value': 'Google Inc', 'rank': 7, 'major': 'N'}]",2021-10-21T16:58:41+0000,Business Day,"{'original': 'By Alan Rappeport', 'person': [{'firstname': 'Alan', 'middlename': None, 'lastname': 'Rappeport', 'qualifier': None, 'title': None, 'role': 'reported', 'organization': '', 'rank': 1}], 'organization': None}",News,341,,,,,,,
247,247.0,It all comes down to having power over what Americans watch and how.,https://www.nytimes.com/2021/10/21/technology/comcast-tvs-streaming.html,The New York Times,"{'main': 'Why the Cable Company Is Selling TVs', 'kicker': 'the on tech newsletter', 'content_kicker': None, 'print_headline': 'Why a Cable Company Is Starting to Sell TVs', 'name': None, 'seo': None, 'sub': None}","[{'name': 'organizations', 'value': 'Comcast Corporation', 'rank': 1, 'major': 'N'}, {'name': 'subject', 'value': 'Television Sets and Media Devices', 'rank': 2, 'major': 'N'}, {'name': 'subject', 'value': 'Cable Television', 'rank': 3, 'major': 'N'}, {'name': 'subject', 'value': 'Video Recordings, Downloads and Streaming', 'rank': 4, 'major': 'N'}]",2021-10-21T16:36:51+0000,Technology,"{'original': 'By Shira Ovide', 'person': [{'firstname': 'Shira', 'middlename': None, 'lastname': 'Ovide', 'qualifier': None, 'title': None, 'role': 'reported', 'organization': '', 'rank': 1}], 'organization': None}",News,1145,,,,,,,
250,250.0,"The co-working company’s trading debut follows a failed I.P.O., a pandemic and more.",https://www.nytimes.com/2021/10/21/business/dealbook/wework-public-spac.html,The New York Times,"{'main': 'WeWork Hits the Stock Markets', 'kicker': 'DealBook Newsletter', 'content_kicker': None, 'print_headline': None, 'name': None, 'seo': None, 'sub': None}","[{'name': 'subject', 'value': 'Mergers, Acquisitions and Divestitures', 'rank': 1, 'major': 'N'}, {'name': 'subject', 'value': 'Bitcoin (Currency)', 'rank': 2, 'major': 'N'}, {'name': 'subject', 'value': 'Social Media', 'rank': 3, 'major': 'N'}, {'name': 'subject', 'value': 'Initial Public Offerings', 'rank': 4, 'major': 'N'}, {'name': 'organizations', 'value': 'AMHERST COLLEGE', 'rank': 5, 'major': 'N'}, {'name': 'organizations', 'value': 'PayPal', 'rank': 6, 'major': 'N'}, {'name': 'organizations', 'value': 'Pinterest', 'rank': 7, 'major': 'N'}, {'name': 'persons', 'value': 'Peltz, Nelson', 'rank': 8, 'major': 'N'}, {'name': 'persons', 'value': 'Manchin, Joe III', 'rank': 9, 'major': 'N'}]",2021-10-21T11:29:18+0000,Business Day,"{'original': 'By Andrew Ross Sorkin, Jason Karaian, Sarah Kessler, Stephen Gandel, Michael J. de la Merced, Lauren Hirsch and Ephrat Livni', 'person': [{'firstname': 'Andrew', 'middlename': 'Ross', 'lastname': 'Sorkin', 'qualifier': None, 'title': None, 'role': 'reported', 'organization': '', 'rank': 1}, {'firstname': 'Jason', 'middlename': None, 'lastname': 'Karaian', 'qualifier': None, 'title': None, 'role': 'reported', 'organization': '', 'rank': 2}, {'firstname': 'Sarah', 'middlename': None, 'lastname': 'Kessler', 'qualifier': None, 'title': None, 'role': 'reported', 'organization': '', 'rank': 3}, {'firstname': 'Stephen', 'middlename': None, 'lastname': 'Gandel', 'qualifier': None, 'title': None, 'role': 'reported', 'organization': '', 'rank': 4}, {'firstname': 'Michael', 'middlename': 'J.', 'lastname': 'de la Merced', 'qualifier': None, 'title': None, 'role': 'reported', 'organization': '', 'rank': 5}, {'firstname': 'Lauren', 'middlename': None, 'lastname': 'Hirsch', 'qualifier': None, 'title': None, 'role': 'reported', 'organization': '', 'rank': 6}, {'firstname': 'Ephrat', 'middlename': None, 'lastname': 'Livni', 'qualifier': None, 'title': None, 'role': 'reported', 'organization': '', 'rank': 7}], 'organization': None}",News,1812,,,,,,,
251,251.0,A merger with a so-called blank check company is poised to give the former president access to hundreds of millions of dollars.,https://www.nytimes.com/2021/10/21/business/media/trump-spac-social-media-venture.html,The New York Times,"{'main': 'Trump Takes Advantage of Wall Street Fad to Bankroll New Venture', 'kicker': None, 'content_kicker': None, 'print_headline': 'Wall St. Fad Helps Trump In Financing  New Venture', 'name': None, 'seo': None, 'sub': None}","[{'name': 'subject', 'value': 'Social Media', 'rank': 1, 'major': 'N'}, {'name': 'subject', 'value': 'News and News Media', 'rank': 2, 'major': 'N'}, {'name': 'subject', 'value': 'Special Purpose Acquisition Companies (SPAC)', 'rank': 3, 'major': 'N'}, {'name': 'subject', 'value': 'Mergers, Acquisitions and Divestitures', 'rank': 4, 'major': 'N'}, {'name': 'subject', 'value': 'Computers and the Internet', 'rank': 5, 'major': 'N'}, {'name': 'subject', 'value': 'Hedge Funds', 'rank': 6, 'major': 'N'}, {'name': 'persons', 'value': 'Trump, Donald J', 'rank': 7, 'major': 'N'}, {'name': 'organizations', 'value': 'Trump Media & Technology Group', 'rank': 8, 'major': 'N'}, {'name': 'organizations', 'value': 'Digital World Acquisition Corp', 'rank': 9, 'major': 'N'}, {'name': 'persons', 'value': 'Orlando, Patrick F', 'rank': 10, 'major': 'N'}]",2021-10-21T22:52:44+0000,Business Day,"{'original': 'By David Enrich, Matthew Goldstein and Shane Goldmacher', 'person': [{'firstname': 'David', 'middlename': None, 'lastname': 'Enrich', 'qualifier': None, 'title': None, 'role': 'reported', 'organization': '', 'rank': 1}, {'firstname': 'Matthew', 'middlename': None, 'lastname': 'Goldstein', 'qualifier': None, 'title': None, 'role': 'reported', 'organization': '', 'rank': 2}, {'firstname': 'Shane', 'middlename': None, 'lastname': 'Goldmacher', 'qualifier': None, 'title': None, 'role': 'reported', 'organization': '', 'rank': 3}], 'organization': None}",News,1115,,,,,,,
257,257.0,"Safety protocols for firearms on set are well established and straight forward, and injuries of any kind are rare.",https://www.nytimes.com/2021/10/22/business/prop-guns-baldwin-shooting.html,The New York Times,"{'main': 'Striving for Authenticity, Films Often Use Real Guns on Set', 'kicker': None, 'content_kicker': None, 'print_headline': 'Films Often Use Real Guns  But Have Safety Protocols', 'name': None, 'seo': None, 'sub': None}","[{'name': 'subject', 'value': 'Firearms', 'rank': 1, 'major': 'N'}, {'name': 'subject', 'value': 'Movies', 'rank': 2, 'major': 'N'}, {'name': 'subject', 'value': 'Television', 'rank': 3, 'major': 'N'}, {'name': 'subject', 'value': 'Accidents and Safety', 'rank': 4, 'major': 'N'}, {'name': 'persons', 'value': 'Baldwin, Alec', 'rank': 5, 'major': 'N'}, {'name': 'creative_works', 'value': 'Rust (Movie)', 'rank': 6, 'major': 'N'}]",2021-10-22T22:52:08+0000,Business Day,"{'original': 'By Brooks Barnes', 'person': [{'firstname': 'Brooks', 'middlename': None, 'lastname': 'Barnes', 'qualifier': None, 'title': None, 'role': 'reported', 'organization': '', 'rank': 1}], 'organization': None}",News,1118,,,,,,,
260,260.0,A knot of problems with Amazon’s system for handling paid and unpaid leaves has led to devastating consequences for workers.,https://www.nytimes.com/2021/10/24/technology/amazon-employee-leave-errors.html,The New York Times,"{'main': 'Inside Amazon’s Worst Human Resources Problem', 'kicker': None, 'content_kicker': None, 'print_headline': 'Flawed System Led to Lost Pay Inside Amazon', 'name': None, 'seo': None, 'sub': None}","[{'name': 'organizations', 'value': 'Amazon.com Inc', 'rank': 1, 'major': 'N'}, {'name': 'subject', 'value': 'Paid Time Off', 'rank': 2, 'major': 'N'}, {'name': 'subject', 'value': 'Workplace Hazards and Violations', 'rank': 3, 'major': 'N'}, {'name': 'subject', 'value': 'Disability Insurance', 'rank': 4, 'major': 'N'}, {'name': 'persons', 'value': 'Jassy, Andrew R', 'rank': 5, 'major': 'N'}, {'name': 'persons', 'value': 'Bezos, Jeffrey P', 'rank': 6, 'major': 'N'}, {'name': 'subject', 'value': 'Organized Labor', 'rank': 7, 'major': 'N'}, {'name': 'subject', 'value': 'Human Resources', 'rank': 8, 'major': 'N'}, {'name': 'glocations', 'value': 'Washington (State)', 'rank': 9, 'major': 'N'}, {'name': 'subject', 'value': 'Computers and the Internet', 'rank': 10, 'major': 'N'}, {'name': 'subject', 'value': 'Domestic Violence', 'rank': 11, 'major': 'N'}]",2021-10-24T22:41:00+0000,Technology,"{'original': 'By Jodi Kantor, Karen Weise and Grace Ashford', 'person': [{'firstname': 'Jodi', 'middlename': None, 'lastname': 'Kantor', 'qualifier': None, 'title': None, 'role': 'reported', 'organization': '', 'rank': 1}, {'firstname': 'Karen', 'middlename': None, 'lastname': 'Weise', 'qualifier': None, 'title': None, 'role': 'reported', 'organization': '', 'rank': 2}, {'firstname': 'Grace', 'middlename': None, 'lastname': 'Ashford', 'qualifier': None, 'title': None, 'role': 'reported', 'organization': '', 'rank': 3}], 'organization': None}",News,1620,,,,,,,
261,261.0,"A team of private security sleuths, in their first public detailing of their efforts, discuss how they used cybercriminals’ mistakes to quietly help victims recover their data.",https://www.nytimes.com/2021/10/24/technology/ransomware-emsisoft-blackmatter.html,The New York Times,"{'main': 'A Rare Win in the Cat-and-Mouse Game of Ransomware', 'kicker': None, 'content_kicker': None, 'print_headline': 'The Sleuths Who Cracked  A Ransomware Operator', 'name': None, 'seo': None, 'sub': None}","[{'name': 'subject', 'value': 'Computer Security', 'rank': 1, 'major': 'N'}, {'name': 'subject', 'value': 'Cyberattacks and Hackers', 'rank': 2, 'major': 'N'}, {'name': 'subject', 'value': 'Extortion and Blackmail', 'rank': 3, 'major': 'N'}, {'name': 'organizations', 'value': 'Emsisoft Ltd', 'rank': 4, 'major': 'N'}, {'name': 'organizations', 'value': 'Cybersecurity and Infrastructure Security Agency', 'rank': 5, 'major': 'N'}, {'name': 'subject', 'value': 'Cyberwarfare and Defense', 'rank': 7, 'major': 'N'}]",2021-10-24T09:00:07+0000,Technology,"{'original': 'By Nicole Perlroth', 'person': [{'firstname': 'Nicole', 'middlename': None, 'lastname': 'Perlroth', 'qualifier': None, 'title': None, 'role': 'reported', 'organization': '', 'rank': 1}], 'organization': None}",News,1292,,,,,,,
262,262.0,"The company hopes a new court show starring the straight-talking judge will help turbocharge its free, ad-supported streaming platform, IMDb TV.",https://www.nytimes.com/2021/10/25/business/amazon-imdbtv-judge-judy.html,The New York Times,"{'main': 'Why Amazon Is in Business With Judge Judy', 'kicker': None, 'content_kicker': None, 'print_headline': 'Why Is Amazon In Business With Judge Judy?', 'name': None, 'seo': None, 'sub': None}","[{'name': 'subject', 'value': 'Television', 'rank': 1, 'major': 'N'}, {'name': 'subject', 'value': 'Video Recordings, Downloads and Streaming', 'rank': 2, 'major': 'N'}, {'name': 'persons', 'value': 'Sheindlin, Judith B', 'rank': 3, 'major': 'N'}, {'name': 'organizations', 'value': 'Amazon.com Inc', 'rank': 4, 'major': 'N'}, {'name': 'creative_works', 'value': 'Judge Judy (TV Program)', 'rank': 5, 'major': 'N'}, {'name': 'organizations', 'value': 'Internet Movie Database', 'rank': 6, 'major': 'N'}, {'name': 'creative_works', 'value': 'Judy Justice (TV Program)', 'rank': 7, 'major': 'N'}]",2021-10-25T07:00:09+0000,Business Day,"{'original': 'By Brooks Barnes', 'person': [{'firstname': 'Brooks', 'middlename': None, 'lastname': 'Barnes', 'qualifier': None, 'title': None, 'role': 'reported', 'organization': '', 'rank': 1}], 'organization': None}",News,1332,,,,,,,
264,264.0,The outcome could bring a second unionization vote at an Amazon warehouse in less than a year.,https://www.nytimes.com/2021/10/25/technology/amazon-staten-island-jfk-union.html,The New York Times,"{'main': 'Amazon workers on Staten Island show they have enough support to hold a union election.', 'kicker': None, 'content_kicker': None, 'print_headline': 'Staten Island Amazon Workers Take Step Toward Union', 'name': None, 'seo': None, 'sub': None}","[{'name': 'subject', 'value': 'Organized Labor', 'rank': 1, 'major': 'N'}, {'name': 'organizations', 'value': 'Amazon.com Inc', 'rank': 2, 'major': 'N'}, {'name': 'organizations', 'value': 'National Labor Relations Board', 'rank': 3, 'major': 'N'}, {'name': 'persons', 'value': 'Palmer, Derrick', 'rank': 4, 'major': 'N'}, {'name': 'persons', 'value': 'Smalls, Christian', 'rank': 5, 'major': 'N'}]",2021-10-25T20:16:51+0000,Technology,"{'original': 'By Karen Weise', 'person': [{'firstname': 'Karen', 'middlename': None, 'lastname': 'Weise', 'qualifier': None, 'title': None, 'role': 'reported', 'organization': '', 'rank': 1}], 'organization': None}",News,429,,,,,,,
265,265.0,Leaders are weighing a new charge on unrealized capital gains for the ultrawealthy.,https://www.nytimes.com/2021/10/25/business/dealbook/democrats-capital-gains-tax.html,The New York Times,"{'main': 'The New Billionaire Tax in Democrats’ Sights', 'kicker': 'DealBook Newsletter', 'content_kicker': None, 'print_headline': None, 'name': None, 'seo': None, 'sub': None}","[{'name': 'subject', 'value': 'High Net Worth Individuals', 'rank': 1, 'major': 'N'}, {'name': 'subject', 'value': 'Greenhouse Gas Emissions', 'rank': 2, 'major': 'N'}, {'name': 'subject', 'value': 'Capital Gains Tax', 'rank': 3, 'major': 'N'}, {'name': 'subject', 'value': 'Bitcoin (Currency)', 'rank': 4, 'major': 'N'}, {'name': 'persons', 'value': 'Wyden, Ron', 'rank': 5, 'major': 'N'}, {'name': 'subject', 'value': 'E-Sports', 'rank': 6, 'major': 'N'}, {'name': 'organizations', 'value': 'FaZe Clan Inc', 'rank': 7, 'major': 'N'}]",2021-10-25T12:13:09+0000,Business Day,"{'original': 'By Andrew Ross Sorkin, Sarah Kessler, Stephen Gandel, Michael J. de la Merced, Lauren Hirsch and Ephrat Livni', 'person': [{'firstname': 'Andrew', 'middlename': 'Ross', 'lastname': 'Sorkin', 'qualifier': None, 'title': None, 'role': 'reported', 'organization': '', 'rank': 1}, {'firstname': 'Sarah', 'middlename': None, 'lastname': 'Kessler', 'qualifier': None, 'title': None, 'role': 'reported', 'organization': '', 'rank': 2}, {'firstname': 'Stephen', 'middlename': None, 'lastname': 'Gandel', 'qualifier': None, 'title': None, 'role': 'reported', 'organization': '', 'rank': 3}, {'firstname': 'Michael', 'middlename': 'J.', 'lastname': 'de la Merced', 'qualifier': None, 'title': None, 'role': 'reported', 'organization': '', 'rank': 4}, {'firstname': 'Lauren', 'middlename': None, 'lastname': 'Hirsch', 'qualifier': None, 'title': None, 'role': 'reported', 'organization': '', 'rank': 5}, {'firstname': 'Ephrat', 'middlename': None, 'lastname': 'Livni', 'qualifier': None, 'title': None, 'role': 'reported', 'organization': '', 'rank': 6}], 'organization': None}",News,1642,,,,,,,
266,266.0,"The order, to be fulfilled between now and the end of next year, is a sign of the growing momentum in the shift toward electric cars.",https://www.nytimes.com/2021/10/25/business/hertz-tesla-electric-vehicles.html,The New York Times,"{'main': 'Tesla Value Tops $1 Trillion After Hertz Orders 100,000 Cars', 'kicker': None, 'content_kicker': None, 'print_headline': 'Tesla’s Value Hits $1 Trillion As Hertz Adds Electric Cars', 'name': None, 'seo': None, 'sub': None}","[{'name': 'subject', 'value': 'Electric and Hybrid Vehicles', 'rank': 1, 'major': 'N'}, {'name': 'subject', 'value': 'Automobile Renting and Leasing', 'rank': 2, 'major': 'N'}, {'name': 'subject', 'value': 'Automobiles', 'rank': 3, 'major': 'N'}, {'name': 'subject', 'value': 'Stocks and Bonds', 'rank': 4, 'major': 'N'}, {'name': 'organizations', 'value': 'Hertz Global Holdings Inc', 'rank': 5, 'major': 'N'}, {'name': 'organizations', 'value': 'Tesla Motors Inc', 'rank': 6, 'major': 'N'}, {'name': 'persons', 'value': 'Musk, Elon', 'rank': 7, 'major': 'N'}]",2021-10-25T12:25:11+0000,Business Day,"{'original': 'By Neal E. Boudette and Niraj Chokshi', 'person': [{'firstname': 'Neal', 'middlename': 'E.', 'lastname': 'Boudette', 'qualifier': None, 'title': None, 'role': 'reported', 'organization': '', 'rank': 1}, {'firstname': 'Niraj', 'middlename': None, 'lastname': 'Chokshi', 'qualifier': None, 'title': None, 'role': 'reported', 'organization': '', 'rank': 2}], 'organization': None}",News,1187,,,,,,,
270,270.0,"The car maker attained $1 trillion market value, but it’s different from others in that group in some big ways.",https://www.nytimes.com/2021/10/26/business/dealbook/tesla-trillion-dollar-company.html,The New York Times,"{'main': 'Tesla Joins an Exclusive Club', 'kicker': 'DealBook Newsletter', 'content_kicker': None, 'print_headline': None, 'name': None, 'seo': None, 'sub': None}","[{'name': 'subject', 'value': 'Securities and Commodities Violations', 'rank': 1, 'major': 'N'}, {'name': 'subject', 'value': 'Workplace Hazards and Violations', 'rank': 2, 'major': 'N'}, {'name': 'subject', 'value': 'Coronavirus (2019-nCoV)', 'rank': 3, 'major': 'N'}, {'name': 'organizations', 'value': 'Digital World Acquisition Corp', 'rank': 4, 'major': 'N'}, {'name': 'organizations', 'value': 'Tesla Motors Inc', 'rank': 5, 'major': 'N'}, {'name': 'organizations', 'value': 'Tyson Foods Inc', 'rank': 6, 'major': 'N'}, {'name': 'organizations', 'value': 'Facebook Inc', 'rank': 7, 'major': 'N'}, {'name': 'persons', 'value': 'Trump, Donald J', 'rank': 8, 'major': 'N'}]",2021-10-26T11:54:53+0000,Business Day,"{'original': 'By Andrew Ross Sorkin, Jason Karaian, Sarah Kessler, Stephen Gandel, Michael J. de la Merced, Lauren Hirsch and Ephrat Livni', 'person': [{'firstname': 'Andrew', 'middlename': 'Ross', 'lastname': 'Sorkin', 'qualifier': None, 'title': None, 'role': 'reported', 'organization': '', 'rank': 1}, {'firstname': 'Jason', 'middlename': None, 'lastname': 'Karaian', 'qualifier': None, 'title': None, 'role': 'reported', 'organization': '', 'rank': 2}, {'firstname': 'Sarah', 'middlename': None, 'lastname': 'Kessler', 'qualifier': None, 'title': None, 'role': 'reported', 'organization': '', 'rank': 3}, {'firstname': 'Stephen', 'middlename': None, 'lastname': 'Gandel', 'qualifier': None, 'title': None, 'role': 'reported', 'organization': '', 'rank': 4}, {'firstname': 'Michael', 'middlename': 'J.', 'lastname': 'de la Merced', 'qualifier': None, 'title': None, 'role': 'reported', 'organization': '', 'rank': 5}, {'firstname': 'Lauren', 'middlename': None, 'lastname': 'Hirsch', 'qualifier': None, 'title': None, 'role': 'reported', 'organization': '', 'rank': 6}, {'firstname': 'Ephrat', 'middlename': None, 'lastname': 'Livni', 'qualifier': None, 'title': None, 'role': 'reported', 'organization': '', 'rank': 7}], 'organization': None}",News,1701,,,,,,,
272,272.0,The results easily topped analysts’ forecasts.,https://www.nytimes.com/2021/10/26/technology/google-profit-third-quarter.html,The New York Times,"{'main': 'Google’s profit and revenue soared in the third quarter.', 'kicker': None, 'content_kicker': None, 'print_headline': None, 'name': None, 'seo': None, 'sub': None}","[{'name': 'subject', 'value': 'Computers and the Internet', 'rank': 1, 'major': 'N'}, {'name': 'subject', 'value': 'Company Reports', 'rank': 2, 'major': 'N'}, {'name': 'subject', 'value': 'Online Advertising', 'rank': 3, 'major': 'N'}, {'name': 'subject', 'value': 'Cloud Computing', 'rank': 4, 'major': 'N'}, {'name': 'organizations', 'value': 'Alphabet Inc', 'rank': 5, 'major': 'N'}, {'name': 'organizations', 'value': 'Google Inc', 'rank': 6, 'major': 'N'}, {'name': 'organizations', 'value': 'YouTube.com', 'rank': 7, 'major': 'N'}]",2021-10-26T20:36:19+0000,Technology,"{'original': 'By Daisuke Wakabayashi', 'person': [{'firstname': 'Daisuke', 'middlename': None, 'lastname': 'Wakabayashi', 'qualifier': None, 'title': None, 'role': 'reported', 'organization': '', 'rank': 1}], 'organization': None}",News,483,,,,,,,
275,275.0,Candid looks at the inner workings of influential tech companies shouldn’t be so rare.,https://www.nytimes.com/2021/10/27/technology/facebook-transparency.html,The New York Times,"{'main': 'Facebook, Show Us the Mess', 'kicker': 'the on tech newsletter', 'content_kicker': None, 'print_headline': None, 'name': None, 'seo': None, 'sub': None}","[{'name': 'subject', 'value': 'internal-sub-only-nl', 'rank': 1, 'major': 'N'}, {'name': 'organizations', 'value': 'Facebook Inc', 'rank': 2, 'major': 'N'}, {'name': 'subject', 'value': 'Social Media', 'rank': 3, 'major': 'N'}, {'name': 'subject', 'value': 'Computers and the Internet', 'rank': 4, 'major': 'N'}]",2021-10-27T16:46:30+0000,Technology,"{'original': 'By Shira Ovide', 'person': [{'firstname': 'Shira', 'middlename': None, 'lastname': 'Ovide', 'qualifier': None, 'title': None, 'role': 'reported', 'organization': '', 'rank': 1}], 'organization': None}",News,974,,,,,,,
277,277.0,"This week, Karen Weise, Grace Ashford and I revealed that as Amazon hit record profits, it fired, underpaid and mishandled employees seeking leaves for new parenthood or medical crises.",https://www.nytimes.com/interactive/2021/10/28/technology/amazon-labor-leave.html,The New York Times,"{'main': 'Cracking Amazon’s Worst H.R. Problem', 'kicker': None, 'content_kicker': None, 'print_headline': None, 'name': None, 'seo': None, 'sub': None}","[{'name': 'organizations', 'value': 'Amazon.com Inc', 'rank': 1, 'major': 'N'}, {'name': 'glocations', 'value': 'Staten Island (NYC)', 'rank': 2, 'major': 'N'}]",2021-10-28T16:13:52+0000,Technology,"{'original': 'By Jodi Kantor', 'person': [{'firstname': 'Jodi', 'middlename': None, 'lastname': 'Kantor', 'qualifier': None, 'title': None, 'role': 'reported', 'organization': '', 'rank': 1}], 'organization': None}",Interactive Feature,0,,,,,,,
