,Unnamed: 0,abstract,web_url,source,headline,keywords,pub_date,section_name,byline,type_of_material,word_count,Column1,stock_price,Unnamed: 12,Unnamed: 13,Unnamed: 14,Unnamed: 15,Unnamed: 16
0,0.0,A hearing officer for the National Labor Relations Board found that Amazon illegally discouraged organizing at an Alabama warehouse. The company can appeal to block a new election.,https://www.nytimes.com/2021/08/02/business/amazon-union-alabama-nlrb.html,The New York Times,"{'main': 'Labor Board Official Backs Union Challenge on Amazon Vote', 'kicker': None, 'content_kicker': None, 'print_headline': 'Official Sides With Union To Challenge Amazon Vote', 'name': None, 'seo': None, 'sub': None}","[{'name': 'subject', 'value': 'Organized Labor', 'rank': 1, 'major': 'N'}, {'name': 'organizations', 'value': 'Amazon.com Inc', 'rank': 2, 'major': 'N'}, {'name': 'organizations', 'value': 'National Labor Relations Board', 'rank': 3, 'major': 'N'}, {'name': 'organizations', 'value': 'International Brotherhood of Teamsters', 'rank': 4, 'major': 'N'}, {'name': 'subject', 'value': 'Workplace Hazards and Violations', 'rank': 5, 'major': 'N'}, {'name': 'glocations', 'value': 'Bessemer (Ala)', 'rank': 6, 'major': 'N'}]",2021-08-02T23:25:23+0000,Business Day,"{'original': 'By Noam Scheiber', 'person': [{'firstname': 'Noam', 'middlename': None, 'lastname': 'Scheiber', 'qualifier': None, 'title': None, 'role': 'reported', 'organization': '', 'rank': 1}], 'organization': None}",News,665,,,,,,,
1,1.0,Details of how the couple split their assets were not made public. The couple was married for 27 years.,https://www.nytimes.com/2021/08/02/business/bill-gates-divorce-melinda-french.html,The New York Times,"{'main': 'Bill Gates and Melinda French Gates finalize their divorce', 'kicker': None, 'content_kicker': None, 'print_headline': 'The Gateses Officially End Their Marriage After 27 Years', 'name': None, 'seo': None, 'sub': None}","[{'name': 'organizations', 'value': 'Gates, Bill and Melinda, Foundation', 'rank': 1, 'major': 'N'}, {'name': 'persons', 'value': 'Gates, Bill', 'rank': 2, 'major': 'N'}, {'name': 'persons', 'value': 'Gates, Melinda', 'rank': 3, 'major': 'N'}, {'name': 'subject', 'value': 'Philanthropy', 'rank': 4, 'major': 'N'}, {'name': 'subject', 'value': 'Suits and Litigation (Civil)', 'rank': 5, 'major': 'N'}, {'name': 'subject', 'value': 'Divorce, Separations and Annulments', 'rank': 6, 'major': 'N'}]",2021-08-02T22:49:34+0000,Business Day,"{'original': 'By Nicholas Kulish', 'person': [{'firstname': 'Nicholas', 'middlename': None, 'lastname': 'Kulish', 'qualifier': None, 'title': None, 'role': 'reported', 'organization': '', 'rank': 1}], 'organization': None}",News,443,,,,,,,
3,3.0,"What’s in the $1 trillion proposal, from broadband and bridges to ports and pedestrian crossings.",https://www.nytimes.com/2021/08/03/business/dealbook/infrastructure-bill-details.html,The New York Times,"{'main': 'Inside the Epic Infrastructure Bill', 'kicker': 'DealBook Newsletter', 'content_kicker': None, 'print_headline': None, 'name': None, 'seo': None, 'sub': None}","[{'name': 'subject', 'value': 'American Jobs Plan (2021)', 'rank': 1, 'major': 'N'}, {'name': 'subject', 'value': 'Infrastructure (Public Works)', 'rank': 2, 'major': 'N'}, {'name': 'subject', 'value': 'Law and Legislation', 'rank': 3, 'major': 'N'}, {'name': 'persons', 'value': 'Biden, Joseph R Jr', 'rank': 4, 'major': 'N'}]",2021-08-03T12:09:40+0000,Business Day,"{'original': 'By Andrew Ross Sorkin, Jason Karaian, Sarah Kessler, Stephen Gandel, Lauren Hirsch and Ephrat Livni', 'person': [{'firstname': 'Andrew', 'middlename': 'Ross', 'lastname': 'Sorkin', 'qualifier': None, 'title': None, 'role': 'reported', 'organization': '', 'rank': 1}, {'firstname': 'Jason', 'middlename': None, 'lastname': 'Karaian', 'qualifier': None, 'title': None, 'role': 'reported', 'organization': '', 'rank': 2}, {'firstname': 'Sarah', 'middlename': None, 'lastname': 'Kessler', 'qualifier': None, 'title': None, 'role': 'reported', 'organization': '', 'rank': 3}, {'firstname': 'Stephen', 'middlename': None, 'lastname': 'Gandel', 'qualifier': None, 'title': None, 'role': 'reported', 'organization': '', 'rank': 4}, {'firstname': 'Lauren', 'middlename': None, 'lastname': 'Hirsch', 'qualifier': None, 'title': None, 'role': 'reported', 'organization': '', 'rank': 5}, {'firstname': 'Ephrat', 'middlename': None, 'lastname': 'Livni', 'qualifier': None, 'title': None, 'role': 'reported', 'organization': '', 'rank': 6}], 'organization': None}",News,1782,,,,,,,
5,5.0,"With the planned sale of Hello Sunshine, the studio she started in 2016, the Oscar winner joins the ranks of Hollywood’s power brokers.",https://www.nytimes.com/2021/08/03/business/media/reese-witherspoon-hello-sunshine-sale.html,The New York Times,"{'main': 'Reese Witherspoon will sell her production studio to a Wall Street-backed company.', 'kicker': None, 'content_kicker': None, 'print_headline': 'Witherspoon Agrees to Sell Production Studio', 'name': None, 'seo': None, 'sub': None}","[{'name': 'subject', 'value': 'Mergers, Acquisitions and Divestitures', 'rank': 1, 'major': 'N'}, {'name': 'subject', 'value': 'Private Equity', 'rank': 2, 'major': 'N'}, {'name': 'subject', 'value': 'Movies', 'rank': 3, 'major': 'N'}, {'name': 'organizations', 'value': 'Hello Sunshine (Be Sunshine LLC)', 'rank': 4, 'major': 'N'}, {'name': 'organizations', 'value': 'Blackstone Group, The', 'rank': 5, 'major': 'N'}, {'name': 'persons', 'value': 'Witherspoon, Reese', 'rank': 6, 'major': 'N'}, {'name': 'persons', 'value': 'Mayer, Kevin A', 'rank': 7, 'major': 'N'}]",2021-08-03T18:19:33+0000,Business Day,"{'original': 'By Lauren Hirsch', 'person': [{'firstname': 'Lauren', 'middlename': None, 'lastname': 'Hirsch', 'qualifier': None, 'title': None, 'role': 'reported', 'organization': '', 'rank': 1}], 'organization': None}",News,607,,,,,,,
6,6.0,Tyson and Microsoft were the latest to require employees to be vaccinated. Other major employers have tried less sweeping approaches.,https://www.nytimes.com/2021/08/03/business/vaccine-mandate-employees-microsoft.html,The New York Times,"{'main': 'After Months of Avoiding the Vaccine Issue, Companies Begin to Mandate', 'kicker': None, 'content_kicker': None, 'print_headline': 'Covid Forces Bosses to Act', 'name': None, 'seo': None, 'sub': None}","[{'name': 'subject', 'value': 'Coronavirus Reopenings', 'rank': 1, 'major': 'N'}, {'name': 'subject', 'value': 'Labor and Jobs', 'rank': 2, 'major': 'N'}, {'name': 'subject', 'value': 'Coronavirus (2019-nCoV)', 'rank': 3, 'major': 'N'}, {'name': 'subject', 'value': 'Vaccination and Immunization', 'rank': 4, 'major': 'N'}, {'name': 'subject', 'value': 'Workplace Hazards and Violations', 'rank': 5, 'major': 'N'}, {'name': 'organizations', 'value': 'Microsoft Corp', 'rank': 6, 'major': 'N'}, {'name': 'organizations', 'value': 'Tyson Foods Inc', 'rank': 7, 'major': 'N'}, {'name': 'organizations', 'value': 'Walmart Stores Inc', 'rank': 8, 'major': 'N'}, {'name': 'organizations', 'value': 'Retail, Wholesale and Department Store Union', 'rank': 9, 'major': 'N'}, {'name': 'organizations', 'value': 'United Food and Commercial Workers Union', 'rank': 10, 'major': 'N'}, {'name': 'organizations', 'value': 'Walt Disney Company', 'rank': 11, 'major': 'N'}]",2021-08-03T21:12:40+0000,Business Day,"{'original': 'By Michael Corkery, Lauren Hirsch, Brooks Barnes and Kellen Browning', 'person': [{'firstname': 'Michael', 'middlename': None, 'lastname': 'Corkery', 'qualifier': None, 'title': None, 'role': 'reported', 'organization': '', 'rank': 1}, {'firstname': 'Lauren', 'middlename': None, 'lastname': 'Hirsch', 'qualifier': None, 'title': None, 'role': 'reported', 'organization': '', 'rank': 2}, {'firstname': 'Brooks', 'middlename': None, 'lastname': 'Barnes', 'qualifier': None, 'title': None, 'role': 'reported', 'organization': '', 'rank': 3}, {'firstname': 'Kellen', 'middlename': None, 'lastname': 'Browning', 'qualifier': None, 'title': None, 'role': 'reported', 'organization': '', 'rank': 4}], 'organization': None}",News,1707,,,,,,,
7,7.0,"A second union vote may be held at an Alabama warehouse, and new tactics by the Teamsters and other groups aim to pressure Amazon across the country.",https://www.nytimes.com/2021/08/04/business/economy/amazon-union-labor.html,The New York Times,"{'main': 'Amazon Faces Wider Fight Over Labor Practices', 'kicker': None, 'content_kicker': None, 'print_headline': 'Wider Fight For Amazon As Unions Get Traction', 'name': None, 'seo': None, 'sub': None}","[{'name': 'organizations', 'value': 'Amazon.com Inc', 'rank': 1, 'major': 'N'}, {'name': 'glocations', 'value': 'Bessemer (Ala)', 'rank': 2, 'major': 'N'}, {'name': 'subject', 'value': 'Organized Labor', 'rank': 3, 'major': 'N'}, {'name': 'subject', 'value': 'Workplace Hazards and Violations', 'rank': 4, 'major': 'N'}, {'name': 'organizations', 'value': 'International Brotherhood of Teamsters', 'rank': 5, 'major': 'N'}, {'name': 'organizations', 'value': 'National Labor Relations Board', 'rank': 6, 'major': 'N'}, {'name': 'organizations', 'value': 'Retail, Wholesale and Department Store Union', 'rank': 7, 'major': 'N'}]",2021-08-04T07:00:09+0000,Business Day,"{'original': 'By Noam Scheiber', 'person': [{'firstname': 'Noam', 'middlename': None, 'lastname': 'Scheiber', 'qualifier': None, 'title': None, 'role': 'reported', 'organization': '', 'rank': 1}], 'organization': None}",News,1412,,,,,,,
8,8.0,"Spotify, YouTube and others are experimenting with changing their one-size-fits-all digital subscriptions.",https://www.nytimes.com/2021/08/04/technology/digital-subscriptions.html,The New York Times,"{'main': 'The Subscription Buffet May Be Over', 'kicker': 'on tech', 'content_kicker': None, 'print_headline': None, 'name': None, 'seo': None, 'sub': None}","[{'name': 'organizations', 'value': 'Disney Plus', 'rank': 1, 'major': 'N'}, {'name': 'organizations', 'value': 'Netflix Inc', 'rank': 2, 'major': 'N'}, {'name': 'organizations', 'value': 'Spotify', 'rank': 3, 'major': 'N'}, {'name': 'organizations', 'value': 'YouTube.com', 'rank': 4, 'major': 'N'}, {'name': 'organizations', 'value': 'Amazon.com Inc', 'rank': 5, 'major': 'N'}, {'name': 'subject', 'value': 'Video Recordings, Downloads and Streaming', 'rank': 6, 'major': 'N'}, {'name': 'subject', 'value': 'Audio Recordings, Downloads and Streaming', 'rank': 7, 'major': 'N'}]",2021-08-04T16:43:17+0000,Technology,"{'original': 'By Shira Ovide', 'person': [{'firstname': 'Shira', 'middlename': None, 'lastname': 'Ovide', 'qualifier': None, 'title': None, 'role': 'reported', 'organization': '', 'rank': 1}], 'organization': None}",News,911,,,,,,,
11,11.0,"The company expects to end the year with about 8.5 million. In its quarterly results, it reported holding nearly $1 billion in cash.",https://www.nytimes.com/2021/08/04/business/media/nyt-new-york-times-earnings-q2-2021.html,The New York Times,"{'main': 'The New York Times Reaches 8 Million Subscriptions', 'kicker': None, 'content_kicker': None, 'print_headline': 'Times, With Focus on Digital, Reports 8 Million Subscribers', 'name': None, 'seo': None, 'sub': None}","[{'name': 'subject', 'value': 'News and News Media', 'rank': 1, 'major': 'N'}, {'name': 'subject', 'value': 'Newspapers', 'rank': 2, 'major': 'N'}, {'name': 'subject', 'value': 'Company Reports', 'rank': 3, 'major': 'N'}, {'name': 'organizations', 'value': 'New York Times Company', 'rank': 4, 'major': 'N'}]",2021-08-04T11:17:34+0000,Business Day,"{'original': 'By Edmund Lee', 'person': [{'firstname': 'Edmund', 'middlename': None, 'lastname': 'Lee', 'qualifier': None, 'title': None, 'role': 'reported', 'organization': '', 'rank': 1}], 'organization': None}",News,843,,,,,,,
13,13.0,The latest corporate vaccine mandates cover more types of workers — and customers.,https://www.nytimes.com/2021/08/04/business/dealbook/vaccine-mandates.html,The New York Times,"{'main': '‘Vaccinated or You Can’t Come In’', 'kicker': 'DealBook Newsletter', 'content_kicker': None, 'print_headline': None, 'name': None, 'seo': None, 'sub': None}","[{'name': 'subject', 'value': 'Vaccination and Immunization', 'rank': 1, 'major': 'N'}, {'name': 'subject', 'value': 'Vaccination Proof and Immunization Records', 'rank': 2, 'major': 'N'}, {'name': 'organizations', 'value': 'Tyson Foods Inc', 'rank': 3, 'major': 'N'}, {'name': 'persons', 'value': 'Biden, Joseph R Jr', 'rank': 4, 'major': 'N'}, {'name': 'subject', 'value': 'Coronavirus (2019-nCoV)', 'rank': 5, 'major': 'N'}]",2021-08-04T11:43:44+0000,Business Day,"{'original': 'By Andrew Ross Sorkin, Jason Karaian, Sarah Kessler, Stephen Gandel, Lauren Hirsch and Ephrat Livni', 'person': [{'firstname': 'Andrew', 'middlename': 'Ross', 'lastname': 'Sorkin', 'qualifier': None, 'title': None, 'role': 'reported', 'organization': '', 'rank': 1}, {'firstname': 'Jason', 'middlename': None, 'lastname': 'Karaian', 'qualifier': None, 'title': None, 'role': 'reported', 'organization': '', 'rank': 2}, {'firstname': 'Sarah', 'middlename': None, 'lastname': 'Kessler', 'qualifier': None, 'title': None, 'role': 'reported', 'organization': '', 'rank': 3}, {'firstname': 'Stephen', 'middlename': None, 'lastname': 'Gandel', 'qualifier': None, 'title': None, 'role': 'reported', 'organization': '', 'rank': 4}, {'firstname': 'Lauren', 'middlename': None, 'lastname': 'Hirsch', 'qualifier': None, 'title': None, 'role': 'reported', 'organization': '', 'rank': 5}, {'firstname': 'Ephrat', 'middlename': None, 'lastname': 'Livni', 'qualifier': None, 'title': None, 'role': 'reported', 'organization': '', 'rank': 6}], 'organization': None}",News,1729,,,,,,,
16,16.0,BlackRock and Wells Fargo also delayed their mandatory returns until October. Both attributed the changes to new developments in the spread of Covid-19.,https://www.nytimes.com/2021/08/05/business/amazon-coronovirus-return-to-office.html,The New York Times,"{'main': 'Amazon pushes its return to office to January.', 'kicker': None, 'content_kicker': None, 'print_headline': 'Amazon Delays Its Return to the Office Until January', 'name': None, 'seo': None, 'sub': None}","[{'name': 'subject', 'value': 'Coronavirus (2019-nCoV)', 'rank': 1, 'major': 'N'}, {'name': 'subject', 'value': 'Coronavirus Return to Office', 'rank': 2, 'major': 'N'}, {'name': 'organizations', 'value': 'BlackRock Inc', 'rank': 3, 'major': 'N'}, {'name': 'organizations', 'value': 'Wells Fargo & Company', 'rank': 4, 'major': 'N'}, {'name': 'subject', 'value': 'Workplace Hazards and Violations', 'rank': 5, 'major': 'N'}, {'name': 'subject', 'value': 'Banking and Financial Institutions', 'rank': 6, 'major': 'N'}]",2021-08-05T16:59:10+0000,Business Day,"{'original': 'By Karen Weise, Kate Kelly and Lananh Nguyen', 'person': [{'firstname': 'Karen', 'middlename': None, 'lastname': 'Weise', 'qualifier': None, 'title': None, 'role': 'reported', 'organization': '', 'rank': 1}, {'firstname': 'Kate', 'middlename': None, 'lastname': 'Kelly', 'qualifier': None, 'title': None, 'role': 'reported', 'organization': '', 'rank': 2}, {'firstname': 'Lananh', 'middlename': None, 'lastname': 'Nguyen', 'qualifier': None, 'title': None, 'role': 'reported', 'organization': '', 'rank': 3}], 'organization': None}",News,462,,,,,,,
19,19.0,"The Indian Supreme Court upheld the U.S. company’s effort to stop the sale of supermarkets, in a rare win for foreign businesses there.",https://www.nytimes.com/2021/08/06/technology/india-amazon-reliance-ambani.html,The New York Times,"{'main': 'Amazon Wins Court Battle in India Against a Local Powerhouse', 'kicker': None, 'content_kicker': None, 'print_headline': 'Amazon Prevails in Court Battle Against a Powerhouse in India', 'name': None, 'seo': None, 'sub': None}","[{'name': 'glocations', 'value': 'India', 'rank': 1, 'major': 'N'}, {'name': 'subject', 'value': 'Politics and Government', 'rank': 2, 'major': 'N'}, {'name': 'subject', 'value': 'E-Commerce', 'rank': 3, 'major': 'N'}, {'name': 'subject', 'value': 'Economic Conditions and Trends', 'rank': 4, 'major': 'N'}, {'name': 'subject', 'value': 'Foreign Investments', 'rank': 5, 'major': 'N'}, {'name': 'subject', 'value': 'Shopping and Retail', 'rank': 6, 'major': 'N'}, {'name': 'subject', 'value': 'Computers and the Internet', 'rank': 7, 'major': 'N'}, {'name': 'subject', 'value': 'Suits and Litigation (Civil)', 'rank': 8, 'major': 'N'}, {'name': 'subject', 'value': 'Mergers, Acquisitions and Divestitures', 'rank': 9, 'major': 'N'}, {'name': 'subject', 'value': 'Supermarkets and Grocery Stores', 'rank': 10, 'major': 'N'}, {'name': 'subject', 'value': 'Antitrust Laws and Competition Issues', 'rank': 11, 'major': 'N'}, {'name': 'organizations', 'value': 'Amazon.com Inc', 'rank': 12, 'major': 'N'}, {'name': 'organizations', 'value': 'Future Group', 'rank': 13, 'major': 'N'}, {'name': 'organizations', 'value': 'Reliance Industries', 'rank': 14, 'major': 'N'}, {'name': 'organizations', 'value': 'Supreme Court of India', 'rank': 15, 'major': 'N'}]",2021-08-06T15:38:40+0000,Technology,"{'original': 'By Karan Deep Singh and Emily Schmall', 'person': [{'firstname': 'Karan', 'middlename': 'Deep', 'lastname': 'Singh', 'qualifier': None, 'title': None, 'role': 'reported', 'organization': '', 'rank': 1}, {'firstname': 'Emily', 'middlename': None, 'lastname': 'Schmall', 'qualifier': None, 'title': None, 'role': 'reported', 'organization': '', 'rank': 2}], 'organization': None}",News,1022,,,,,,,
21,21.0,"United Airlines employees will be required to upload proof of vaccination within five weeks of the Food and Drug Administration’s fully approving a vaccine or by Oct. 25, whichever comes first.",https://www.nytimes.com/2021/08/06/business/united-airlines-vaccines.html,The New York Times,"{'main': 'United Airlines will require vaccination, and Amazon revives mask mandates.', 'kicker': None, 'content_kicker': None, 'print_headline': 'United to Require Vaccines for U.S. Workers, and Amazon Revives Mask Mandate', 'name': None, 'seo': None, 'sub': None}","[{'name': 'subject', 'value': 'AIRLINES AND AIRPLANES', 'rank': 1, 'major': 'N'}, {'name': 'subject', 'value': 'Vaccination and Immunization', 'rank': 2, 'major': 'N'}, {'name': 'subject', 'value': 'Vaccination Proof and Immunization Records', 'rank': 3, 'major': 'N'}, {'name': 'subject', 'value': 'Coronavirus Reopenings', 'rank': 4, 'major': 'N'}, {'name': 'organizations', 'value': 'United Airlines', 'rank': 5, 'major': 'N'}, {'name': 'persons', 'value': 'Kirby, Scott (1967- )', 'rank': 6, 'major': 'N'}, {'name': 'persons', 'value': 'Hart, Brett J (1969- )', 'rank': 7, 'major': 'N'}]",2021-08-06T11:30:05+0000,Business Day,"{'original': 'By Niraj Chokshi', 'person': [{'firstname': 'Niraj', 'middlename': None, 'lastname': 'Chokshi', 'qualifier': None, 'title': None, 'role': 'reported', 'organization': '', 'rank': 1}], 'organization': None}",News,533,,,,,,,
22,22.0,How to interpret the latest numbers.,https://www.nytimes.com/2021/08/06/business/dealbook/jobs-report-july.html,The New York Times,"{'main': 'The Labor Market’s Message', 'kicker': 'DealBook Newsletter', 'content_kicker': None, 'print_headline': None, 'name': None, 'seo': None, 'sub': None}","[{'name': 'subject', 'value': 'Labor and Jobs', 'rank': 1, 'major': 'N'}, {'name': 'subject', 'value': 'United States Economy', 'rank': 2, 'major': 'N'}, {'name': 'organizations', 'value': 'Apple Inc', 'rank': 3, 'major': 'N'}, {'name': 'subject', 'value': 'Electric and Hybrid Vehicles', 'rank': 4, 'major': 'N'}]",2021-08-06T12:08:30+0000,Business Day,"{'original': 'By Andrew Ross Sorkin, Jason Karaian, Sarah Kessler, Stephen Gandel, Lauren Hirsch and Ephrat Livni', 'person': [{'firstname': 'Andrew', 'middlename': 'Ross', 'lastname': 'Sorkin', 'qualifier': None, 'title': None, 'role': 'reported', 'organization': '', 'rank': 1}, {'firstname': 'Jason', 'middlename': None, 'lastname': 'Karaian', 'qualifier': None, 'title': None, 'role': 'reported', 'organization': '', 'rank': 2}, {'firstname': 'Sarah', 'middlename': None, 'lastname': 'Kessler', 'qualifier': None, 'title': None, 'role': 'reported', 'organization': '', 'rank': 3}, {'firstname': 'Stephen', 'middlename': None, 'lastname': 'Gandel', 'qualifier': None, 'title': None, 'role': 'reported', 'organization': '', 'rank': 4}, {'firstname': 'Lauren', 'middlename': None, 'lastname': 'Hirsch', 'qualifier': None, 'title': None, 'role': 'reported', 'organization': '', 'rank': 5}, {'firstname': 'Ephrat', 'middlename': None, 'lastname': 'Livni', 'qualifier': None, 'title': None, 'role': 'reported', 'organization': '', 'rank': 6}], 'organization': None}",News,1735,,,,,,,
26,26.0,Climate change and other big problems won’t be solved by tech alone.,https://www.nytimes.com/2021/08/10/technology/tech-solutions.html,The New York Times,"{'main': 'Tech Can’t Fix It', 'kicker': 'on tech', 'content_kicker': None, 'print_headline': 'Technology Alone Can’t Fix It', 'name': None, 'seo': None, 'sub': None}","[{'name': 'subject', 'value': 'Computers and the Internet', 'rank': 1, 'major': 'N'}, {'name': 'subject', 'value': 'Global Warming', 'rank': 2, 'major': 'N'}]",2021-08-10T16:29:16+0000,Technology,"{'original': 'By Shira Ovide', 'person': [{'firstname': 'Shira', 'middlename': None, 'lastname': 'Ovide', 'qualifier': None, 'title': None, 'role': 'reported', 'organization': '', 'rank': 1}], 'organization': None}",News,840,,,,,,,
27,27.0,A rise in starting salaries could help counter burnout but pandemic precautions might become a more important differentiator.,https://www.nytimes.com/2021/08/10/business/dealbook/wall-street-junior-bankers.html,The New York Times,"{'main': 'Wall Street Splashes Cash on Junior Bankers', 'kicker': 'DealBook Newsletter', 'content_kicker': None, 'print_headline': None, 'name': None, 'seo': None, 'sub': None}","[{'name': 'subject', 'value': 'Labor and Jobs', 'rank': 1, 'major': 'N'}, {'name': 'subject', 'value': 'Federal Budget (US)', 'rank': 2, 'major': 'N'}, {'name': 'subject', 'value': 'Unemployment', 'rank': 3, 'major': 'N'}, {'name': 'subject', 'value': 'Banking and Financial Institutions', 'rank': 4, 'major': 'N'}, {'name': 'subject', 'value': 'United States Economy', 'rank': 5, 'major': 'N'}]",2021-08-10T12:06:08+0000,Business Day,"{'original': 'By Andrew Ross Sorkin, Jason Karaian, Sarah Kessler, Stephen Gandel, Lauren Hirsch, Ephrat Livni and Anna Schaverien', 'person': [{'firstname': 'Andrew', 'middlename': 'Ross', 'lastname': 'Sorkin', 'qualifier': None, 'title': None, 'role': 'reported', 'organization': '', 'rank': 1}, {'firstname': 'Jason', 'middlename': None, 'lastname': 'Karaian', 'qualifier': None, 'title': None, 'role': 'reported', 'organization': '', 'rank': 2}, {'firstname': 'Sarah', 'middlename': None, 'lastname': 'Kessler', 'qualifier': None, 'title': None, 'role': 'reported', 'organization': '', 'rank': 3}, {'firstname': 'Stephen', 'middlename': None, 'lastname': 'Gandel', 'qualifier': None, 'title': None, 'role': 'reported', 'organization': '', 'rank': 4}, {'firstname': 'Lauren', 'middlename': None, 'lastname': 'Hirsch', 'qualifier': None, 'title': None, 'role': 'reported', 'organization': '', 'rank': 5}, {'firstname': 'Ephrat', 'middlename': None, 'lastname': 'Livni', 'qualifier': None, 'title': None, 'role': 'reported', 'organization': '', 'rank': 6}, {'firstname': 'Anna', 'middlename': None, 'lastname': 'Schaverien', 'qualifier': None, 'title': None, 'role': 'reported', 'organization': '', 'rank': 7}], 'organization': None}",News,1762,,,,,,,
28,28.0,"EBay is not reimagining space travel, and that’s totally fine.",https://www.nytimes.com/2021/08/11/technology/ebay-survival-lesson.html,The New York Times,"{'main': 'EBay’s Survival Lesson', 'kicker': 'on tech', 'content_kicker': None, 'print_headline': 'A Survival Lesson as eBay Finds Its Groove', 'name': None, 'seo': None, 'sub': None}","[{'name': 'organizations', 'value': 'eBay Inc', 'rank': 1, 'major': 'N'}, {'name': 'subject', 'value': 'E-Commerce', 'rank': 2, 'major': 'N'}]",2021-08-11T16:39:20+0000,Technology,"{'original': 'By Shira Ovide', 'person': [{'firstname': 'Shira', 'middlename': None, 'lastname': 'Ovide', 'qualifier': None, 'title': None, 'role': 'reported', 'organization': '', 'rank': 1}], 'organization': None}",News,835,,,,,,,
32,32.0,Just six months ago it was valued at $6 billion. It raised $410 million in its latest round.,https://www.nytimes.com/2021/08/12/technology/reddit-new-funding.html,The New York Times,"{'main': 'Reddit is valued at more than $10 billion in latest funding round.', 'kicker': None, 'content_kicker': None, 'print_headline': 'New Funds Push Reddit’s Valuation to $10 Billion', 'name': None, 'seo': None, 'sub': None}","[{'name': 'organizations', 'value': 'Reddit Inc', 'rank': 1, 'major': 'N'}, {'name': 'persons', 'value': 'Huffman, Steve (1983- )', 'rank': 2, 'major': 'N'}, {'name': 'subject', 'value': 'Venture Capital', 'rank': 3, 'major': 'N'}, {'name': 'subject', 'value': 'Online Advertising', 'rank': 4, 'major': 'N'}, {'name': 'subject', 'value': 'Computers and the Internet', 'rank': 5, 'major': 'N'}, {'name': 'subject', 'value': 'Social Media', 'rank': 6, 'major': 'N'}]",2021-08-12T11:00:07+0000,Technology,"{'original': 'By Mike Isaac', 'person': [{'firstname': 'Mike', 'middlename': None, 'lastname': 'Isaac', 'qualifier': None, 'title': None, 'role': 'reported', 'organization': '', 'rank': 1}], 'organization': None}",News,449,,,,,,,
